lang/code,lang/conf,group,description,title,url,geo/type,geo/coordinates/0/0,geo/coordinates/0/1,tags/0,spider,employmentType/0,lastSeen,jobLocation/0,identifier,hiringOrganization/0,firstSeen,employmentType/1,sector,industry,subIndustry,hiringOrganization/1,tags/1,tags/2,employmentType/2,employmentType/3,employmentType/4,employmentType/5,employmentType/6,employmentType/7,employmentType/8,hiringOrganization/2,hiringOrganization/3,hiringOrganization/4,hiringOrganization/5en,1,JobServe,"**The Company**Our client is one of Australia's leading and largest Financial ServicesOrganization that has expanded its operations beyond the Australian shores.The organization has a large range of financial offerings to both public andprivate clients across the retail, corporate and institutional banking areas.They have a very large technical footprint that combine a dynamic range oftechnologies in a complex landscape. Due to internal promotion they nowrequire a technical (Infrastructure/Operations) Lead Capacity (demandmanagement) and Performance Engineer with a passion for Data Science/Analyticsand Modelling as it relates to the Resiliency and High Availability ofbusiness critical banking systems.**The Group**This Performance team has a very large remit, to evaluate and improve bankwide systems with a focus on high availability, performance, scalability andreliability. Comprised of Solution Performance Engineers they are accountablefor the availability health of key production systems with a particular focuson governing, evaluating, managing and influencing non-functional risks &attributes across the solution delivery life cycle (requirements, design &architecture, testing). This accountability traverses to the productionenvironment with accountability for capacity planning and providing qualityassurance over the accuracy of tactical performance, capacity and availabilityanalytics delivered by other teams.**The Role**After laying the groundwork and initiating the creation of an advancedCapacity and Performance based algorithmic analytics and modelling system forthe banks performance group the current incumbent is moving into a more seniorposition. To fill these shoes, so to speak, you'll need a thoroughunderstanding of IT Performance, Resilience, High Availability and Capacity(Demand Management) across business critical banking/transactional systems asit relates to the world of Operations (DevOps). To be successful in theperformance group you'll need a holistic/enterprise understanding of how alltechnology layers, Infrastructure (OS, Database, Networks),Middleware/Messaging and Application, interrelate and ultimately affect large,high volume web portals. Essentially you'll be responsible for the analysis ofthese systems and to work with the business to optimize, eliminate bottlenecksand project future usage. There's a large emphasis on Data Science (BigData)/Analytics and modelling so proficiency in this area along with relatedtechnologies like: R, Hadoop, Haskell or similar are essential.**Skills required**  * Expertise in IT Capacity and Performance: Data Science/Analytics, Statistics and Modelling.   * An Infrastructure/Operations (DevOps) background with a deep understanding of how all technology layers: Infrastructure (OS, DB, NW), Middleware/Messaging and Application interrelate.   * A strong base in Infrastructure or Operations (Support) ideally DevOps.   * Deep understanding of systems architecture in large complex organisations.   * Experience performance tuning large, complex web portals and/or Back End systems - experience in Telco, Gaming/Betting, Transactional, Trading Systems would be advantageous.   * Technically proficient with Data Science/Big Data Tools: R, Ruby, Hadoop, Haskell or similar.   * Technology related Degree/Diploma and/or industry relevant certifications.  * Full, unrestricted Australian work rights (Citizen/PR).**Keywords: **Capacity Planning, Capacity Lead, High Availability, Infrastructure, Performance Metrics, Tuning, Optimisation, High Volume Portals, Data Science/Analytics, Statistics, Modelling.If this position interests you, please submit your resume via the 'Apply Now'button or email. Or for further information please contact **Daniel** quotingreference **CAPSTONE**.Unfortunately this opportunity does not offer visa sponsorship so please onlyapply if you already have full working rights for Australia.**All communications will be treated as confidential and the more we know about you the better we can help you ...**iKas International Finance Technology Specialists",INFRASTRUCTURE/OPERATIONS CAPACITY ENGINEER - BANKING SYSTEMS,"http://www.jobserve.com/au/en/search-jobs-in-Sydney,-New-South-Wales,-Australia/INFRASTRUCTURE-OPERATIONS-CAPACITY-ENGINEER-BANKING-SYSTEMS-543577C7303B6CBB/",MultiPoint,151.20773,-33.86482,Job Board,jobserveAu,Contract/Permanent,2014-12-16T03:50:15,"Sydney CBD, Australia",543577C7303B6CBB,iKas International,2014-12-09T04:13:50+00:00,,,,,,,,,,,,,,,,,,
en,1,SAP SE,"AE-59241749-EN-14-002 Consulting 0% - 50% Regular Full Time SAP is the globalmarket leader for business software and thus contributes a considerable partof the world's economic power grid. At SAP you get your chance to put yourideas into action with maximum impact.SAP is the largest European softwarecompany with around 50,000 employees all over the world, providing businessapplication software to companies of all industries and all sizes. Around athird of these employees work in the SAP Services division, which offersconsulting, training, and technical support services to SAP customers. SAPConsulting is currently expanding a team that provides advanced analyticsservices to customers, helping them to improve their business based onscientific analysis of large amounts of business data. A Data Scientist isresponsible for supporting customers to define and analyze complex businessproblems, implementing predictive analytics models as well as leveraging hisextended SAP team for use of SAP Big Data technologies to provide advancedanalytics solutions that successfully address customers' needs The DataScientist works in a diverse and geographical dispersed SAP team environmentthat includes Science & Technology Consultants, Business Industry experts, andSales & Marketing organizations. This position requires the ability to workand communicate as a part of a high performance team in an internationalenvironment.- Experience in developing software, in at least one of thetechnologies/products from each of the following areas: - Datawarehousing/reporting/ETL: HANA, Sybase, ORACLE - Database programming: SQL,PL/SQL, T-SQL - Programming: Java, C++, ABAP - Mathematical modeling: MatLab,Predictive Workbench/SPSS, SAS, R, Kxen (SAP Infinite Insight), SAP PredictiveAnalytics, SAP HANA Predictive Analytics Library - Experience in working inproject teams. Several projects full lifecycles desired. - Familiar withProject Management methodologies and deliverables (PMI, Prince 2, Agile) -Relevant industry experience (Retail, Consumer Products, Utilities, Finance,Banking, Automotive or Public Sector) is a plus In addition to a strong datascience and analytics background, the position requires strong problem-solvingand consulting capabilities with the ability to communicate effectively in aninternational team environment. The ideal candidate covers a major part of thefollowing expertise areas: Background: - Strong in mathematics and statistics- Strong software development experience - Experience in mathematical modelingand optimization - Excellent understanding of statistical and technicalmethods to produce relevant information out of huge amounts of data -Experience working on Big Data & Analytics projects - Experience with BusinessAnalytics technologies - Experience working with business users - Experiencefacilitating workshop - Experience working in an international environmentPersonal skills: - Willingness and ability to learn quickly new mathematicalor technical methods with little guidance - Willingness to participate in thesales process as a subject matter expert - Ability to inspire confidence andwork with all levels of client and internal staff - Ability to deliver clear,concise presentations to non-scientific audiences - High energy, clear goalorientation and strong work ethic; ""can do"" attitude - Excellent verbal andwritten communication skills. English at advanced level is a must Customerfacing skills: - Ability to capture customer requirements and translate theminto software specifications - Ability to present complex information in aclear and precise manner; with non-technical audience - Professionalappearance and demeanor - Presentation skills - ability to create professionalpresentations, handle proper setup of location, use technical/visual aid, haveadequate body language and vocabulary, proactively engage with customer andhandle questionsSalary grade: T3/T4",Data Scientist for Data Science Go-To-Market - Technology Senior (Principal) Consultant [f/m] Job,http://jobs.sap.com/job/Virtual-Data-Scientist-for-Data-Science-Go-To-Market-Technology-Senior-%28Principal%29-Consultant-fm-Job/74592900/,MultiPoint,54.5,23.75,DAX,sap,Consulting,2014-11-05T02:54:17,"Virtual, United Arab Emirates",74592900,Consulting,2014-07-19T20:37:03+00:00,ERP,Technology,Software,Application Software,SAP,Consulting,ForbesMVB,Scientific,Database,Consultant,Contract,Engineering,Regular Full Time,Technology,,,,
en,1,Accenture PLC,"## - Jobbeschreibung**Skill: Accenture Analytics Analyst****Level: Analyst****Location: Dubai******Join Accenture and help transform leading organizations and communities aroundthe world. The sheer scale of our capabilities and client engagements and theway we collaborate, operate and deliver value provides an unparalleledopportunity to grow and advance. Choose Accenture, and make deliveringinnovative work part of your extraordinary career.The digital revolution is changing everything. It’s everywhere – transforminghow we work and play. Are you leading the way as a digital disrupter?Accenture Digital is driving these exciting changes and bringing them to lifeacross 40 industries in more than 120 countries. At the forefront of digitalyou’ll create it, own it, and make it a reality for clients looking to betterserve their connected customers and operate always-on enterprises.**Accenture Digital** is powered by three practices –Mobility, Interactive, and Analytics. As part of our Analytics practice, you’ll deliver analytically-informed, issue-based solutions that help clients make faster, smarter decisions. You’ll play a critical role in helping them tackle complex business issues. **Accenture Digital Analytics **professionals serve our clients by harvesting strategic insights from data and develop predictive modeling capabilities that target and deliver value across a wide array of corporate functions. Strong candidates will have a consulting or agency background with excellent subject matter expertise and hands-on experience in planning, supporting, implementing and deploying leading-edge digital marketing data & analytics solutions. **_Job Description_****The Analytics Executive **is a client-facing role that interprets, translates, and synthesizes client requirements into a solution that can be configured from a standard or highly-customized set of Accenture offerings. The Analytics Executive operates as a single point of leadership contact or as part of a team (on larger engagements with multiple Executives) accountable from Stage 0 (pre-engagement) to deal closure while leading delivery and/or the transition to the service fulfillment organization(s). **_Key Responsibilities for the Analytics Executive include, but are not limited to:_**  * **General Management**    * Lead and deliver large scale, complex client engagements that identify, design, and implement creative analytical solutions for large companies     * Design, implement and oversee the quality of deliverables produced by our service professionals   * **Financials and Resourcing**    * Understanding and clearly define the correct inputs required to create cost estimates     * Work with national resourcing teams to staff your projects## + Basis Qualifikationen**_Basic Qualifications:_**  * Minimum of Bachelor's Degree required in a related field; strong preference for fields of study in the computer science, engineering, economics, data science and statistics   * 2+ years of increasing leadership experience in management consulting or industry   * 1+ years of Analytics delivery experience   * Experience with Big Data technologies (Hadoop, Cassandra, Hive, Pig, Impala, Parquet, etc.) and large Data Warehouse implementation (Oracle, Teradata, GreenPlum, SAP Hana, Netezza TF)  * Experience in CRM Modeling, Analytics & Campaign Execution (SAS, Unica, Teradata, Oracle)  * Expertise with the Microsoft Office suite (including advanced Excel skills with embedded Pivot Tables & Macros; advanced PowerPoint usage for storyboard design and presentation) ******_Preferred Qualifications:_**  * **Customer Analytics**    * Ability to bring industry leading expertise and point-of-view on customer analytics, CRM, marketing, and customer data platform     * Strong understanding of statistical concepts and predictive modeling. (e.g., AI neural networks, multi-scalar dimensional models, logistic regression techniques, machine-based learning, etc.)   * **Education and Experience**    * Master’s degree preferred in computer science, engineering, economics, data science and statistics**_  Professional Skill Requirements _**  * Ability to build, manage and foster a team-oriented environment   * Ability to work creatively and analytically in a problem-solving environment   * Desire to work in an strategy, analytics and technology-driven environment   * Excellent communication (written and oral) and interpersonal skills   * Excellent leadership and management skills",Accenture Digital & Analytics Analyst,https://www.accenture.com/de-de/careers/jobdetails?id=00270930_en,,,,Consulting,accenture,Analyst,2015-07-16T02:21:09.100000,,00270930,Accenture,2015-06-10T00:06:42+00:00,,Technology,Technology Services,IT Services,Business & Technology Integration,,,,,,,,,,,,,
en,1,Microsoft Corp,"If you are excited about developers and interested in using data science tomake Windows a better platform, this is the job for you. We are a team in theOperating System Group using data science principles to more deeply understandour developers and further advance the Windows platform. Our mission is totransform the organization into a data driven culture which makes productdecisions based on actionable metrics.    We support a larger organization in its quest to improve quality through theuse of data. Working in partnership with other developer-focused teams, wewill ensure a great developer experience built from excellent tools, a world-class API surface, and a solid Windows platform. We will utilize the Build-Measure-Learn loop to enhance the lives of developers on a world-class Windowsplatform.    This Senior Software Engineer position will focus on applying machine learningand data science techniques to our business questions. Work will includeconducting data analysis for broad insights, providing insight to our datascience projects, and training others on critical tools and processes. Ourteam is highly iterative and candidates must be willing to try new things,learn from failure, and continually improve.    We are looking for a candidate who is an experienced software engineer whoalso understands the fundamentals of data science and machine learning. Wework closely with other teams making collaborative skills a big plus.    Required Skills:  8+ years of software development and/or test development  A Computer Science degree or equivalent experience  Experience with Machine Learning and Data Science    Optional, useful skills:  R, IPython, PowerBI, or other data analysis tools  Knowledge of the Windows platform (Win32/WinRT)  Experience building Windows Apps  Experience with C++, C#, JavaScript, and SQL    Microsoft is an equal opportunity employer. All qualified applicants willreceive consideration for employment without regard to race, color, gender,sexual orientation, gender identity or expression, religion, national origin,marital status, age, disability, veteran status, genetic information, or anyother protected status.",Senior Software Engineer,http://m.careersatmicrosoft.com/home#job/911355,MultiPoint,-122.1238767,47.6694141,ForbesMVB,microsoft,,2015-04-17T03:11:02.315000,"Redmond (WA), US",911355,Testing (engineering),2015-04-11T03:10:58+00:00,,Technology,Software,Infrastructure Software,Microsoft,,,,,,,,,,Operating systems,,,
de,1,Siemens AG,"**Job ID:** 180858  **Ort:** München  **Organisation:** Mobility  **Art der Anstellung:** Unbefristet**Gemeinsam machen wir den Unterschied**In der Division Mobility sind die Zugtechnik und die Bahnautomatisierung vonSiemens  zusammengefasst. Die beiden Bereiche adressieren das Wachstumsfeld SmartMobility mit  intelligenten und integrierten Lösungen. Dazu gehören unter anderemSchienenfahrzeuge und die  dazugehörigen Serviceleistungen, Bahnelektrifizierung, Infrastrukturlogistiksowie intelligente  Verkehrs- und Transportsysteme.Werden Sie jetzt Teil unseres Teams von Mobility als  Data Science Engineer (m/w) in München.**Ihr neues Aufgabenfeld –  herausfordernd und zukunftsorientiert**  * Entwicklung innovativer Lösungen zur Datenanalytik bestehend aus entsprechenden Technologien, Algorithmen und Applikationen – von der Ideenentwicklung über Prototypen bis hin zu skalierbaren industriellen Systemen  * Identifizierung und Bewertung unbekannter Beziehungen in den Daten vom Fahrzeugen, Infrastruktur und anderen Daten um businessrelevante Erkenntnisse zu gewinnen  * Durchführung explorativer Datananalysen in komplexen Datenstrukturen  * Erstellung wiederverwendbarer analytischer Modelle und Operationalisierung solcher Modelle in der Analytikplattform  * Erstellung entsprechender Visualisierungen für die Ergebnisse derartiger analytischer Modelle  * Zusammenarbeit mit Businessverantwortlichen zum Verständnis der Geschäftsanforderungen und zur Identifizierung von Geschäftsmöglichkeiten durch Datenanalytik  * Implementierung und Management von “Big Data”-Projekten mit dem Fokus auf moderner Datenanalytik, maschinellem Lernen und industriellen Applikationen**Ihre Qualifikationen –  fundiert und adäquat**  * Erfolgreich abgeschlossenes Hochschulstudium der Informatik, Mathematik, Physik, Ingenieurswissenschaften oder ähnlicher Fachrichtungen  * Mehrjährige Erfahrung im Kontext von “Data science” und moderner Datenanalytik  * Starke Erfahrungen in Technologien, Algorithmen und Methoden zur Datenanalytik, insbesondere im Umfeld Data Mining, maschinellem Lernen und Simulation  * Kenntnissen relationaler Datenbanken (SQL) und NoSQL-Datenbanken bzw. Hadoop, sowie Programmierkenntnisse insbesondere in Java, C# oder C++  * Erfahrung in der Nutzung analytischer Tools und Systeme, insbesondere R und anderer Arbeitswerkzeuge zum Data Mining  * Fähigkeit Schlussfolgerungen aus Daten zu ziehen und entsprechende Handlungen vorzuschlagen  * Starke Präsentations- und Kommunikationsfähigkeiten, insbesondere die Fähigkeit komplexe Analysen in klarer und umsetzbarer Form den Geschäften zu kommunizieren  * Selbstmotivation, Initiative, Durchsetzungsfähigkeit und starke Ergebnisorientierung  ------    **So treten Sie mit uns in Kontakt – einfach und direkt****www.siemens.de/m-de**  wenn Sie vor Ihrer Bewerbung mehr über den Geschäftsbereich erfahren möchten  **+49 (9131) 7-35335**  wenn Sie erste Fragen gern persönlich mit unserem Recruiting Team klärenmöchten.  Ansprechpartnerin dieser Stellenausschreibung ist Frau Carolin Henneberger  **www.siemens.de/bewerbung**  wenn Sie mehr Informationen über den Bewerbungsablauf und unsere Leistungenfür Mitarbeiter  erfahren möchten. Bei gleicher Qualifikation berücksichtigt Siemensschwerbehinderte Bewerber  und diesen gleichgestellten Menschen bevorzugt.",Data Science Engineer (m/w),https://jobsearch.siemens.biz/career?career%5fns=job%5flisting&company=Siemens&navBarLevel=JOB%5fSEARCH&rcm%5fsite%5flocale=de%5fDE&career_job_req_id=180858,MultiPoint,11.5939413306902,48.1781156,DAX,siemens,Vollzeit,2014-12-23T02:59:53,"Deutschland, München",180858,Siemens,2014-10-08T03:06:15+00:00,Experienced Professional,Industrials,Electrical Equipment,Electrical Power Equipment,Engineering,ForbesMVB,,Unbefristet,,,,,,,Mobility,,,
en,1,Vodafone Group PLC,"!*! Skills:- // Primary Skills:- Business Anlaysis, Telecom, SAS // SecondarySkills :- SQL,, Statistics // // Role Purpose:- // // To understand businessrequirement of Group/OpCo // To identify and guide data team for righttables/data sets/analysis which will help in completing piece of analysis orproject // To develop expert level understanding of database of OpCo Businessknowledge // To have SAS EG/EM, Excel/PPT or Teradata SQL expertise to presentfinding back to UK team // To perform validation & present findings withbusiness logics // Key accountabilities:- // // Regular presentation ofanalysis/project to Product/Pricing/CVM management team in UK with rightBusiness , data & statistical inputs. // Strategic as analysis/insights willbe used to drive business decisions of Product/Pricing/CVM managers. // Highinteraction with UK Enterprise team // Lead team of data anayst, insightspecialst & statistical modeller in completing analysis/projects. // CreatePOC in Sentiment Analytics/Big Data/ Data Science // Should have background inTelecom or Data Science. // Behavioral/ Personality Specifications required:// // Excellent interpersonal & presentation skill // Detail conscious,Problem solver // Innovative & logical thinker // Ability to work underpressure to tight deadlines. // Team player with positive attitude // Goodcommunication skills both oral & written!*! Desired Profile:- // Essential:-// // 5+ years professional experience in Excel skill and Strategic/CommercialAnalysis // 5+ years of experience in telecom domain // Experience inAnalytics Modelling using SAS EG/EM // Desired:- // // 5+ years in SAS // 5+years of SQL/Terada Environment // Excellent data interpretation skills &experience of working with international clients // Education/ Technical/Functional Qualifications and/or Professional Certifications: // Essential:-// // B.E/B.Tech (from reputed institute), MBA // Statistics // Desired:- //// Analytics Certification",Manager - CVM Anlaytics,https://vodafone.taleo.net/careersection/2a/jobdetail.ftl?job=VOD0006LG&lang=en,MultiPoint,73.7655114,18.6566342,,vodafoneEn,Permanent,2015-07-15T07:11:24.170000,"India, Pune",737145,Vodafone,2015-05-20T03:02:11+00:00,Full-time,Communications,Telecom,Telecom Carriers,Vodafone Shared Services India (Ame_IN-Mahar-Pune-001) Grd to 4th Floor,,,,,,,,,,Cluster D Wing - 3,EON Free Zone,Kharadi Pune,411014
