lang/code,lang/conf,group,description,title,url,geo/type,geo/coordinates/0/0,geo/coordinates/0/1,tags/0,spider,employmentType/0,lastSeen,jobLocation/0,identifier,hiringOrganization/0,firstSeen,employmentType/1,sector,industry,subIndustry,hiringOrganization/1,tags/1,tags/2,employmentType/2,employmentType/3,employmentType/4,employmentType/5,employmentType/6,employmentType/7,employmentType/8,hiringOrganization/2,hiringOrganization/3,hiringOrganization/4,hiringOrganization/5de,1,Bundesverwaltungsamt,"## Tätigkeitsprofil:Unsere Mission: Wir erforschen das Leben und die Erde im Dialog mit denMenschen.Das** Museum für Naturkunde Berlin (MfN)** ist mit seinen über 30 MillionenSammlungsobjekten eines der größten Naturkundemuseen weltweit.Zusammengetragen als Beleg für die Diversität der Natur, sind seine Sammlungenzugleich Zeugnisse der Wissenschafts- und der Kulturgeschichte. Das Museum fürNaturkunde Berlin ist als Forschungseinrichtung und Stiftung des ÖffentlichenRechts seit 1. Januar 2009 Mitglied der Leibniz-Gemeinschaft.**Bezeichnung: Softwareentwickler/in****Arbeitszeit: **100 v.H.d.regelm. wöchentlichen Arbeitszeit**Befristung:** Zum nächstmöglichen Zeitpunkt und ist befristet bis 31.01.2016  Drittmittelfinanzierung**Entgeltgruppe:** E11 TV-L Berlin**Projektbeschreibung:**  Das DFG-geförderte Projekt „German Federation for the Curation of BiologicalData (GFBio)” (http://www.gfbio.org/) arbeitet am Aufbau einer grundlegendeForschungsinfrastruktur, die den Austausch von biologischen undumweltbezogenen Forschungsdaten ermöglichen bzw. vereinfachen soll. DasProjekt befindet sich derzeitig in einer 18-monatigen Pilotphase.Das Ziel des Forschungsbereichs „Digitale Welt und Informationsmanagement“ istdie Implementierung einer zukunftsfähigen Architektur für naturkundliche Datenund Datenrepositorien, welche neue Möglichkeiten zur Beantwortung vonForschungsfragen sowohl im Bereich „Data Science“ als auch „Public Engagementwith Science“ eröffnet.Die erfolgreiche Bewerberin/der erfolgreiche Bewerber wird folgende**Aufgaben** im Rahmen des Projekt GFBio am MfN übernehmen:  • Entwicklung GFBio relevanter Softwaretools (BioCASe Monitor Service, Specify6 Workbench) und Anfertigen einer lückenlosen Dokumentation  • Technische Betreuung und (konzeptionelle) Weiterentwicklung derDatenpublikation am MfN  o Weiterentwicklung einer Webschnittstelle zur langfristigen Publikation vonGFBio Daten des MfN (stabile URIs mit HTML und RDF Landing Pages)  o Durchführung relevanter Anpassungen am MfN Datenmapping undWeiterentwicklung eines Transformationsschemas (ABCD-Schema zum GFBioZielschema)  o Vernetzung des MfN als internationales Data Center  • Teilnahme an Projekttreffen, Telefonkonferenzen und Mitarbeit anFortschrittsberichten## Anforderungsprofil:**Anforderungen:**  • Abgeschlossenes Hochschulstudium der Informatik, Geo- oder Bioinformatikoder eines ingenieur- bzw. naturwissenschaftlichen Studienganges, welcherAspekte dieser Disziplinen beinhaltet, oder mindestens 3-jährigeBerufserfahrung in zuvor genannten Bereichen und Mitwirkung in entsprechendenReferenzprojekten  • Gute Kenntnisse in der Programmierung webbasierter Software  • Kenntnisse mind. einer höheren Programmiersprache (vorzugsweise Java)  • Kenntnisse im Umgang mit Source Code Repositorien  • Sehr gute Kenntnisse in der Skriptsprache PHP  • Gute Kenntnisse in der Verwendung von SQL-Datenbankmanagementsystemen(vorzugsweise MySQL)  • Kenntnisse in der Verarbeitung von XML und Erstellung von XSLT  • Erfahrungen mit Austauschstandards naturkundlicher Sammlungsdaten (z.B.ABCD, ABCD-EFG, DarwinCore)  • Interesse an der Arbeit mit forschungs- und sammlungsbezogenen Datennaturkundlicher Forschungsmuseen  • Erfahrungen im Führen einer Projektdokumentation und im Verfassen vonprojektbezogenen Fortschrittsberichten  • Gute Kommunikations- und Präsentationsfähigkeiten  • Sehr gute Deutsch- und Englischkenntnisse in Wort und Schrift    **Hinweise:**  Zur Sicherung der Gleichstellung sind Bewerbungen qualifizierter Frauenbesonders willkommen. Schwerbehinderte Bewerber/innen werden bei gleicherEignung bevorzugt.Bewerbungen mit den üblichen Unterlagen (Lebenslauf, Zeugnisse) sowie einemAnschreiben mit Erläuterungen zu Ihrer Erfahrung sind **bis zum 11.05.2015unter Angabe der Kennziffer 21/2015 **an Museum für Naturkunde,Personalreferat, Invalidenstraße 43, 10115 Berlin zu rich-ten.Bitte beachten Sie, dass eine Rücksendung von Unterlagen und Bewerbungsmappennur mit beigefügtem Rückumschlag erfolgt. Zu unserer Entlastung bitten wir Sievon der Zusendung von Bewerbungsmappen abzusehen, und mit der Bewerbungausschließlich Kopien in einfacher gehefteter Form einzureichen.**Weitere Informationen: **  Familienpolitik: Das Naturkundemuseum Berlin hat sich die Förderung derVereinbarkeit von Beruf und Familie zum Ziel gesetzt und wurde hierfür mit demZertifikat zum audit berufundfamilie der audit berufundfamilie gGmbH- eineInitivative der Gemeinnützigen Hertie-Stiftung - ausgezeichnet.  Weiterführende Informationen finden Sie unter: http://www.naturkundemuseum-berlin.de/institution/vereinbarkeit-von-beruf-und-familie/",Soft­wa­re­ent­wick­ler/in,http://www.bund.de/IMPORTE/Stellenangebote/EDITOR/Museum-fuer-Naturkunde-Berlin/2015/04/1212998.html?nn=4642046&type=0&searchResult=true,MultiPoint,13.3888599,52.5170365,Job Board,bund,Vollzeit,2015-05-18T01:13:16.136000,Berlin,1212998,Museum für Naturkunde Berlin,2015-04-28T01:02:53+00:00,Befristet,,,,,,,Gehobener Dienst,,,,,,,,,,
de,1,ZEIT ONLINE,"Die Hochschule der Medien in Stuttgart bildet Medienspezialisten fürUnternehmen, Organisationen und Institutionen aus. In 16 Bachelor- und 7Masterstudiengängen bieten wir derzeit über 4.500 Studie­ren­den attraktiveStudienmöglichkeiten.    In der Fakultät Information und Kommunikation ist im StudiengangWirtschaftsinformatik und digitale Medien folgende Professur zu be­setz­en:# PROFESSUR FÜR WIRTSCHAFTS­INFORMATIK, INSBESONDERE  BIG DATA UND DATA SCIENCE## ab Wintersemester 2015/2016  Besoldungsgruppe W2, Kennziffer SS1503PWir suchen eine Wirtschaftsinformatikerin/einen Wirtschafts­in­for­matiker mitausgewiesener theoretischer und praktischer Kompetenz in den ThemenbereichenData Science, Data-Warehouse-Archi­tek­turen, Big-Data-Algorithmen sowiePredictive Analytics, die/der u. a. folgende Fachinhalte in Forschung undLehre vertritt:    * Datenbanken  * Analytische Informationssysteme  * Business IntelligenceFür inhaltliche Fragen steht Ihnen Herr Prof. Dr. Peter Lehmann per E-Mail an gerne zurVerfügung.    Die Fähigkeit zum Angebot von Lehrveranstaltungen in englischer Sprache wirderwartet. Darüber hinaus wird eine ein­schlä­gige Promotion gefordert. Dieweiteren Einstellungs­vo­raus­setzungen (§47 LHG), zusätzliche Informationenüber diese Pro­fessur und un­ser Bewerbungsportal finden auf un­serer Homepageunter    **    Wir freuen uns auf Ihre Bewerbung. Diese sollte **_ausschließlich_** überunser Bewerberportal erfolgen und bis zum **20\. April 2015** bei uns sein.**Bewerbungsschluss: 20.04.2015**Bewerbungsschluss: 20.04.2015 Erschienen am 26.03.2015 in","Professur (W2) für Wirtschaftsinformatik, insbesondere Big Data und Data Science",http://jobs.zeit.de/jobs/stuttgart_professur_w2_fuer_wirtschaftsinformatik_insbesondere_big_data_und_data_science_112223.html,MultiPoint,9.1800456,48.7784931,Job Board,zeit,,2015-04-20T01:23:24.231000,Stuttgart,112223,Hochschule der Medien Stuttgart (HdM),2015-04-02T02:32:59+00:00,,,,,,,,,,,,,,,,,,
en,1,Deutsche Bank AG,"# Vice President - MET Credit Quant**Job ID: **3113380  **Full/Part-Time: **Full-time  ------  **Regular/Temporary: **Regular  **Listed: **2015-06-04  **Location: **Mumbai, India    A Passion to Perform. It’s what drives us. More than a claim, this describesthe way we do business. We’re committed to being the best financial servicesprovider in the world, balancing passion with precision to deliver superiorsolutions for our clients. This is made possible by our people: agile minds,able to see beyond the obvious and act effectively in an ever-changing globalbusiness landscape. As you’ll discover, our culture supports this. Diverse,international and shaped by a variety of different perspectives, we’re drivenby a shared sense of purpose. At every level agile thinking is nurtured. Andat every level agile minds are rewarded with competitive pay, support andopportunities to excel.In the world’s financial markets, Deutsche Bank CIB: Markets is anacknowledged leader. We regularly win awards and top industry polls for ourhigh-performing investment banking products and services. Our 6,400 employeesaround the world have a reputation for being highly focused. We provideclients with unique insights, vast experience and an unparalleled level ofservice.Our top-ranked business offerings include bonds, equities, FX, money marketproducts, commodities and all forms of derivatives and structured investment,financing and risk management products. We are active throughout Europe, NorthAmerica, Asia and all the world's emerging markets.## Position Overview**CIB Centre Overview:**Deutsche CIB Centre, a Deutsche Bank Group company, provides extensivestructuring, quantitative analytics, platform development and executionsupport from its location in Mumbai and regulated offices in the US and theUK. With over 550 professionals performing cutting-edge modeling, quant,analytics, and research, Deutsche CIB Centre assists Deutsche Bank’s Corporateand Investment Banking teams around the globe in delivering innovativefinancial solutions to international clients in less time and at lower cost.This global reach provides you with huge opportunities to develop your careerlocally as well as globally.**Job Summary:**Global Client Solutions (GCS) sits within the GFX business within FIC. It isresponsible for the development and management and revenue growth of GFX’sclient facing platforms for the purpose of distributing liquidity andattracting transactional flow. The Maestro is one of the core GCS Platform.This role is for Trading support of the Maestro business.**Responsibilities:**The Maestro business requires a follow-the-sun model in terms of trading andmonitoring capability. The Trading function, shared between the Hubs and DBCenters, relates to the technical aspects of the services, system functioning,market risk management and final pricing and terms. Customization andintegration of the system with client data also fall upon the tradingfunction.DB Center resource would have primary responsibility for  * Monitoring system orders, proper functioning of the hedging and client trade capture infrastructure  * Initiation of all non-automated tasks (e.g. reporting, procedures within the tactical infrastructure)  * Risk monitoring, and basic client support (trade-related, non-technical)This role’s responsibilities would ideally expand to VBA coding/modificationsin the current infrastructure and the scripting that will drive certainfeatures of the future strategic architecture.**Candidate Specification:**  * Candidate should be a numeric, very detail oriented and vigilant individual  * An experienced coder / Information Systems oriented individual would be strongly favored  * Experience in FX markets, treasury, or trading support a plus as would be any experience in data science related projects.  * Advanced Level Excel Skills including Macro and Automation  * Experience with Microsoft Access  * SQL preferred but not mandatory  * Excellent communication and inter personal skillsIn return, Deutsche Bank offers a challenging and rewarding career where yourcontribution is valued and rewarded. We have an inclusive and friendly workingenvironment coupled with excellent facilities and benefits.Deutsche Bank is an equal opportunity employer who seeks to recruit andappoint the best available person for a job regardless of marital / civilpartnership status, sex (including pregnancy), age, religion, belief, race,nationality and ethnic or national origin, colour, sexual orientation ordisability.Please let us know if you require any adjustments to enable you to apply orattend an interview. If you would like to discuss your requirements, or haveany concerns about the application process, please contact your recruiter.",Vice President - MET Credit Quant,https://jobsearch.db.com/index.php?ac=jobad&id=22941,MultiPoint,72.8327112,18.9523804,DAX,deutschebank,Vollzeit,2015-06-17T02:06:11.313000,"Indien, Mumbai",22941,Deutsche Bank,2015-06-09T03:58:57+00:00,Unbefristet,Financials,Banking,Diversified Banks,Structuring,,,Vice President,,,,,,,,,,
de,1,Daimler AG,"#### TasksDie Abteilung ITP/AC verantwortet die Informationsverarbeitung in derAuftragseinplanung, der Produktionssteuerung und der PKW-Auslieferung derMercedes-Benz-Werke.  Zur Datenanalyse der Produktionsdaten sind verschiedene Themen im Bereich BigData, Data MIning und Data Science vorhanden.  Ihre Aufgaben umfassen:  Einarbeitung in fachlichen Fragestellungen aus der Produktion  Einarbeitung in ausgewählte Algorithmen zur Datenanalyse  Erstellung einer Prototyp-Implementierung des Algorithmuses zur DatenanalyseDokumentation, Analyse und Bewertung der Ergebnisse vor dem Hintergrund derfachlichen Anforderungen  Erstellung einer Abschlußpräsentation#### QualificationsStudiengang: Informationstechnische Studiengänge  Sprachkenntnisse: Deutsch und Englisch in Wort und Schrift  IT-Kenntnisse: SQL-Datenbanken, Java-Programmierung, algorithmisches Denken  Persönliche Kompetenzen: engagierte Arbeitsweise und ausgeprägteTeamfähigkeit, selbständige und strukturierte Arbeitsweise#### Additional informationDie Tätigkeit ist in Vollzeit, befristet auf 6 MonateSie haben Interesse? Dann bewerben Sie sich bitte ausschließlich online überunsere Homepage mit Ihren vollständigen Unterlagen als Anhang (Lebenslauf mitAngabe der Staatsangehörigkeit, Immatrikulationsbescheinigung, aktuellerNotenspiegel, relevante Zeugnisse und Nachweis über die Regelstudienzeit).  Angehörige von Staaten außerhalb des europäischen Wirtschaftsraums schickenggf. bitte Ihre Aufenthalts-/Arbeitsgenehmigung mit.    Fragen zur Stelle beantwortet Ihnen gerne Herr Dr. Bell aus dem Fachbereich,unter der Telefonnummer +49 7031/90-70734 bzw. siegfried.bell@daimler.com.  Fragen zum Bewerbungsprozess beantwortet Ihnen gerne HR Services unter derTelefonnummer +49 711/17-99544.",Abschlussarbeit ab Juni 2015 im Bereich Big Data und Data Science,http://jobs.daimler.com/index.php?ac=jobad&id=20157,MultiPoint,9.0036877,48.7084215,DAX,daimler,Thesis,2015-05-08T00:52:08.592000,Sindelfingen,142193,"Sindelfingen, Mercedes-Benz Werk",2015-04-15T01:03:59+00:00,,Consumer Discretionary,Automotive,Automobiles,IT / Telekommunikation,ForbesMVB,,,,,,,,,Daimler,,,
en,1,Bayer AG,"Country Germany Location Berlin Division Bayer HealthCare Contact us Phone +49214 30 99779 www.karriere.bayer.de Reference Code 0000134291 Bayer welcomesapplications from all individuals, regardless of racial or ethnic origin, skincolor, nationality, religion, philosophy, gender, age, disability, appearanceor sexual identity. We are committed to treating all applicants fairly andavoiding discrimination. Bayer is a global enterprise with core competenciesin the fields of health care, agriculture and high-tech polymer materials. Asan innovation company, it sets trends in research-intensive areas. Bayer’sproducts and services are designed to benefit people and improve their qualityof life.(cid:160)Bayer HealthCare combines the global activities of the AnimalHealth, Consumer Care, Medical Care and Pharmaceuticals divisions. Its aim isto discover, develop, manufacture and market products that will improve humanand animal health worldwide.(cid:160)At Bayer you have the opportunity to bepart of a culture where we value the passion of our employees to innovate andgive them the power to change. IT Specialist (Business Partner) forPharmacometrics (CLS) (m/f) YOUR TASKS AND RESPONSIBILITIES(cid:160) •Establish IT capabilities to strengthen Clinical Pharmacometrics,bioinformatics and data science • Strengthen IT capabilities required for aneffective and efficient access to research, pre-clinical and clinical data aswell as electronic health data to support cross-functional R&D; activities• Design and create IT environment to ease modelling and simulating ofbiological processes • Support Clinical Pharmacometrics department withtailored solutions for mechanistic modelling and its application in thepharmaceutical R&D; area • Work in interdisciplinary teams to provideconcepts to leverage knowledge out of data • Execute business capabilityanalysis and user requirements analysis to derive tailored concepts for ITanalytics challenges in R&D; • Consulting regarding the identification,evaluation and implementation of innovative IT solutions for ClinicalPharmacometrics • Interact with, participate in external scientificcooperation(s) in translational R&D; • Drive holistic data integration forBayer Healthcare R&D; • Contribute to selected critical IT projects tosteer them towards the key objectives, e.g. by steering individual workpackages • Lead project teams with internal and external staff • Monitorbusiness implications, compliance issues, risks and business satisfactionthroughout project lifecycle WHO YOU ARE(cid:160) • Graduate (m/f) in naturalsciences, computer sciences, mathematics or equivalent • Several years ofexperience in business and IT, preferably in the healthcare environment •Data- and Knowledge management, especially in data annotation, as well as inuse of Passion to innovate Power to change (cid:160) (cid:160) Contact usPhone +49 214 30 99779 www.karriere.bayer.de Reference Code 0000134291ontologies or controlled vocabulary • Strong analytical thinking andconceptual skills to define goal-oriented approaches • Ability to handlemultiple tasks and responsibilities • Being self-reliant and capable of both,independent work and as member of a team • Professional experience in insightgeneration from data, e.g. text mining and machine learning, cloud computingand HPC • Proven ability and fun to work in a competitive, fast changing andmulticultural environment • Strong focus on contributing to business values •Ability to support change in complex organizations YOUR APPLICATION(cid:160)For this Computational Life Science position we offer a competitive salary inan international environment as well as excellent opportunities forprofessional and personal development. If your background and personalexperience fits this profile, please send us your complete application atwww.career.bayer.de, submitting a cover letter, your CV and references as wellas your salary expectation. Passion to innovate Power to change (cid:160)",IT Specialist (Business Partner) for Pharmacometrics (CLS) (m/f),https://MYBAYERJOB.BAYERBBS.COM/sap/bc/bsp/sap/hrrcf_wd_dovru/application.do?PARAM=cmNmdHlwZT1waW5zdCZwaW5zdD0wMDUwNTY4OTAwQjQxRUQ1ODVCM0YzMkFFQkI4ODI1Mg%3d%3d&sap-client=005&sap-language=EN,MultiPoint,13.3888599,52.5170365,DAX,bayer,,2015-07-16T03:18:05.389000,"Berlin, Deutschland",cG9zdF9pbnN0X2d1aWQ9MDA1MDU2ODkwMEI0MUVENTg1QjNGMzJBRUJCODgyNTImY2FuZF90eXBlPQ%3d%3d,Bayer,2015-06-19T00:22:59+00:00,,Health Care,Biotech & Pharma,Large Pharma,,,,,,,,,,,,,,
en,1,adidas AG,"Country: Canada Job Function: Research & DevelopmentState / Province: QuebecPosition Type: Full timeCity / Location: Ville St. Laurent Brand: ReebokCCMRelocation: No SelectionHockey is not just another sport. Hockey is acommitment. Of time. Of body. Of self. A commitment that is measured inbruises and missing teeth. In last second goals and divisional titles.Noteveryone has it. But for those of us who do, the opportunity for greatness isimmense. Commitment is at the very core of how we practice, how we play, andwhat we wear. For over 100 years the most committed players have geared upwith one brand-CCM.Because no one is as committed to the game as we are. Weare designers of true hockey equipment. For true hockey players. From theworld’s best fitting skate to the world’s lightest stick.The committed playersof tomorrow will be gearing up with us, but will you be?The mainresponsibility of the Biomechanics Research Developer - Sticks will be toadvise the stick engineering development team on player mechanics in order tocreate and drive higher performing products. This will be achieved throughdetailed analysis of internal data collection (lab and field testing) andexternal research partners. Included in this role will be to evaluate alltesting protocols from a biomechanical point of view, and conduct regularliterature reviews for all product categories. This position will act as a keyliaison between the development teams and our academic researchpartners.Responsabilities:Stick Performance Analysis• Manage the StickPerformance Laboratory including all data collectionStick Fitting Analysis•Design a method of fitting players with the correct stick for the shootingtechniqueBiomechanical Research• Conduct and present research on playermechanics with an entrepreneurial spirit• Provide stick developers withinsights on player techniques and interactions with products• Keep up-to-datewith current research and maintain an archive of relevant scientificpublications for referenceOn Ice Testing• Review and create on ice testingprotocols• Conduct, analyse and report on testingAcademic Liaison• Monitor anddirect projects with Academic partners for all productcategoriesQualifications & Skills:• Master Degree in either Kinesiology orBiomechanics, or a relevant field and preferable to have research experiencein sport; or a similar combination of educational and work relatedexperience.• Excellent command of both English and French; Oral and written;•Ability to effectively communicate and positively influence both internal andexternal stakeholders;• Knowledge of Microsoft Powerpoint, Excel and Word;•Strong knowledge of research methods in biomechanics to ensure valid datacollection and advanced analytical tools for investigating human movementincluding relevant software such a MatLab or equivalent• Strength instatistical analysis tools such as Stastictica, R, or PSPP• Ability to workefficiently and meet all internal timelines;• Excellent presentation skills,experience giving presentations• Familiarity with hockey product andmarketingPosting Notes: Ville St. Laurent Quebec Canada Reebok CCM Americas No Selection",Biomechanics Research Developer - Sticks - Développeur de la recherche biomécanique - Bâtons,http://jobs.adidas-group.com/job/Ville-St_-Laurent-Biomechanics-Research-Developer-Sticks-D%C3%A9veloppeur-de-la-recherche-biom%C3%A9canique-B%C3%A2tons-QC/259849700/,MultiPoint,-73.6825556459289,45.50725095,DAX,adidas,Developer,2015-06-16T01:21:58.073000,"Ville St. Laurent, QC, Canada",259849700,adidas Group,2015-04-11T00:48:47+00:00,Research,Consumer Discretionary,Apparel & Textile Products,"Apparel, Footwear & Acc Design",,ForbesMVB,,Engineer,Statistics,Laboratory,Technology,Engineering,Data,Science,,,,
