lang/code,lang/conf,group,description,title,url,geo/type,geo/coordinates/0/0,geo/coordinates/0/1,tags/0,spider,employmentType/0,lastSeen,jobLocation/0,identifier,hiringOrganization/0,firstSeen,employmentType/1,sector,industry,subIndustry,hiringOrganization/1,tags/1,tags/2,employmentType/2,employmentType/3,employmentType/4,employmentType/5,employmentType/6,employmentType/7,employmentType/8,hiringOrganization/2,hiringOrganization/3,hiringOrganization/4,hiringOrganization/5de,1,Volkswagen AG,"# Mitarbeit in bestehenden Vorentwicklungsprojekten # Weiterentwicklung vonSystemen um lernende Komponenten und Verknüpfung von Diensten, Nutzer-und/oder Fahrzeugdaten # Einbeziehen von konzeptionellen, technischen undstrategischen Anforderungen in den Entwicklungsprozess # Überblick überbereits bestehende Datensätze sowie Aufstellen von Anforderungen zur Erhebungneuer Daten # Auswahl geeigneter Ansätze zur Datenanalyse, -verarbeitung und-visualisierung je nach Fragestellung # Präsentation von Analyse-Ergebnissenund Ansätzen zur Datenverarbeitung vor Kollegen und Management # Auf Basis derDatenanalyse werden technische Anforderungen an die Erhebung und Verarbeitungder Daten wie auch an die Fahrzeug-Backend-Schnittstelle formuliert #Aussteuern von Entwicklungspartnern bei der Umsetzung von Software Modulen #Enge Zusammenarbeit sowohl mit der Vorentwicklung im Bereich HMI-Konzepte alsauch im Bereich Schwarmdatentechnologien sowie Abstimmung mit dem DataAnalytics Team # Aufarbeitung von Ergebnissen in eine breit nutzbare Form #Top-Managementtaugliche Präsentation von Ergebnissen ; # Mitarbeit inbestehenden Vorentwicklungsprojekten # Weiterentwicklung von Systemen umlernende Komponenten und Verknüpfung von Diensten, Nutzer- und/oderFahrzeugdaten # Einbeziehen von konzeptionellen, technischen und strategischenAnforderungen in den Entwicklungsprozess # Überblick über bereits bestehendeDatensätze sowie Aufstellen von Anforderungen zur Erhebung neuer Daten #Auswahl geeigneter Ansätze zur Datenanalyse, -verarbeitung und -visualisierungje nach Fragestellung # Präsentation von Analyse-Ergebnissen und Ansätzen zurDatenverarbeitung vor Kollegen und Management # Auf Basis der Datenanalysewerden technische Anforderungen an die Erhebung und Verarbeitung der Daten wieauch an die Fahrzeug-Backend-Schnittstelle formuliert # Aussteuern vonEntwicklungspartnern bei der Umsetzung von Software Modulen # EngeZusammenarbeit sowohl mit der Vorentwicklung im Bereich HMI-Konzepte als auchim Bereich Schwarmdatentechnologien sowie Abstimmung mit dem Data AnalyticsTeam # Aufarbeitung von Ergebnissen in eine breit nutzbare Form # Top-Managementtaugliche Präsentation von Ergebnissen ; # Mehrjährige Erfahrung imEinsatz von Datenverarbeitungs- und Visualisierungsmethoden, d.h. Algorithmen,Bibliotheken, Tools (z.B. Weka, R, Tableau, SAS, SPSS) # Fachkenntnisse imBereich Datenbankmanagement-Systeme (z.B. PostgreSQL) # Mehrjährige Erfahrungin der Durchführung von Softwareprojekten und in der objektorientiertenSoftwareentwicklung (z.B. Java, C++) # Fachkenntnisse im Bereich VernetzeSysteme, Kommunikationsprotokolle und Webservices (z.B. http, REST, XML,Middleware) # Idealweise berufliche Erfahrung im Umgang mit Fahrzeugdaten undin der Entwicklung von Systemen für den Automobilbereich sowie Erfahrung imUmgang mit einem nutzerzentrierten Entwicklungsprozess ; # Hochschulstudium inInformations- und Kommunikationstechnik, Informatik, Data Science,Elektrotechnik oder Nachrichtentechnik # Idealerweise Weiterbildung in Formeiner Promotion # Mehrjährige Berufserfahrung in der Datenanalyse und–verarbeitung, z.B. in den Bereichen Machine Learning und Predictive Analysis;",Funktionsvorentwicklung Smart Car (m/w),https://karriere.audi.de/cui/default.htm?configurationId=ZAU_UNREG_SEARCH&publicationId=54F40E7924DB0C70E10080000AFA1432,MultiPoint,11.4250395,48.7630165,DAX,audi,Vollzeit,2015-04-30T00:12:27.618000,"Ingolstadt, Deutschland",54F40E7924DB0C70E10080000AFA1432,Forschung / Entwicklung,2015-03-03T02:13:39+00:00,Direkteinstieg - Indirekte MA,Consumer Discretionary,Automotive,Automobiles,AUDI AG,ForbesMVB,,,,,,,,,Volkswagen,,,
en,1,Salesforce.com inc,"**About the position**  Salesforce.com is the enterprise cloud computing leader. Our digital marketingtechnologies-including our flagship sales and CRM applications-help companiesconnect with customers, partners, and employees in entirely new ways. Withmore than 100,000 customers worldwide, we are proud to contribute to thesuccess of companies of all sizes and industries, around the globe. If you'repassionate about innovation, come help revolutionize how companies collaborateand communicate with customers.    The Marketing Cloud product team is looking for an experienced productmanagement and technology professional who is passionate and experienced atpartnering with data science engineering and has a track record for drivingnew product capabilities from initial concept to successful delivery andmarket adoption. The product management role has both inbound and outboundresponsibilities. Inbound responsibilities consist of working with thetechnology team to deliver a world-class cloud computing application driven bycustomers, prospects, advisory teams and internal product experts. Outboundresponsibilities include meeting with customers, prospects and industryanalysts to discuss product requirements and the product roadmap. This job isfor experienced product managers who thrive in a fast paced collaborativeenvironment and love working with the best technology team in the world.    **Key responsibilities**  • Work with product and engineering leadership to define and deliver the nextgeneration of our data science capabilities. This includes defining marketneeds, product vision and strategy, roadmap creation and communication,release planning, requirements gathering, functional specification all the waythrough to customer enablement and success.    • Provide leadership within the data science engineering team, and work veryclosely with development, QA, user experience, documentation and other productteams to execute the Marketing Cloud data science product strategy.    • Employ an outside-in approach to data science by owning and driving featuredelivery end-to-end: writing user stories, working with user experience tocreate prototypes for usability testing, working with development, technicalpublications, and quality assurance teams to deliver a marketable product ontime.    • Engage with enterprise customers for requirements gathering, featurerequests and roadmap updates.    • Represent salesforce.com as a domain and product expert for data science atcustomer interactions, industry and corporate events.    **Requirements**  • Academic expertise and/or equivalent experience in statistics, data scienceand big data technology.    • 3+ years of experience in Product Management or Systems/Business Analysis.    • Analytics / BI / Visualization product management experience a very strongplus.    • Excellent organizational skills, analytic capabilities, and attention todetail.    • Proven ability to influence cross-functional teams without formal authority.    • Strong communication skills.    • Cloud computing experience.    • Demonstrated experience in the agile software development process.    • Demonstrated experience in gathering and transforming customer needs into anactionable product vision and requirements definition.    • Strong troubleshooting and analytical thinking skills.    • Bachelors' degree, with technical disciplines preferred    LI-Y","Senior Product Manager, Data Science",http://salesforce.careermount.com/career/40349/Senior-Product-Manager-Us-Indiana-Indianapolis,MultiPoint,-122.41942,37.77493,,salesforce,,2015-08-03T05:07:59.785000,US - California - San Francisco (HQ),40349,Salesforce,2015-07-03T03:23:06+00:00,,Technology,Software,Application Software,Technology - Technology Program Management,,,,,,,,,,,,,
en,1,Cap Gemini SA,"### LocationLondon  ### About Capgemini ConsultingCapgemini Consulting is the management consulting discipline of the CapgeminiGroup, one of the world’s largest providers of Consulting, Technology andOutsourcing services. We offer transformational excellence throughunderstanding specific customer needs in all business sectors.Our Business Analytics Team is Capgemini Consulting’s business analytics andmodelling capability. The team delivers analytical solutions and advisoryservices to a wide range of clients across a number of industry sectors. OurClients look to us to work with them collaboratively and provide the expertiseand structured thinking that will help them develop innovative solutions tocomplex business problems. The team is currently expanding and we are lookingfor graduates consultants to join the team.    ### Main Purpose of RoleYou will be part of a leading Business Analytics practice in the UK withinCapgemini Consulting. You will undertake a wide variety of challenging projectwork and help our clients optimise their business processes, improveoperations and drive performance improvement. You will be encouraged and havethe licence to develop new ways of delivering value. When allocating work, wealways try to match individual development needs with those of the business.We are looking for talented people with relevant qualifications to help usgrow. The type of work that you might get involved in will vary from:• Using modelling and analytically based techniques to solve business problemsas part of a major business transformation, or specialised pieces of work suchas economic modelling, business case development, risk modelling,optimisation, simulation, systems dynamics and forecasting.  • Developing and using modelling tools to support strategic decision making.  • Delivering analytical advisory services to clients.  • Developing both thought leadership points of view and new service offeringsto differentiate us in the marketplace.Skills Required  To succeed you will need to possess and demonstrate a number of competencies:• A track record of academic achievement (ABB at A-level or equivalent) and a2.1 degree in a numerate subject e.g. Maths, Stats, Industrial Engineering,Economics  • MSc. post-graduate qualification in an analytical subject such asOperational Research, Data Science, Management Science, Statistics or DecisionScience. Essential or 1-2 years work experience in Analytics or Data Science.  • You will be familiar with Customer Insight, Business Insight, PricingStrategy, Yield Management / Revenue Management, Data Analytics, BusinessModelling, Business Intelligence, Data Mining, Data Modelling, OperationalResearch, Forecasting or Decision Science.  • Experience of tools such as Splus/SAS/SPSS/R/Excel.  • A proven ability to rigorously analyse complex issues and develop insightsand solutions.  • An ability to provide creative thinking and innovative methods.  • Good presentation and influencing skills.  • An ability to work in mixed teams of colleagues and clients.  • Outstanding communication and interpersonal skills with high levels ofenthusiasm and a good team player.  • Drive & commitment to own and deliver outstanding work.",Management Consulting Graduate Programme 2015,https://www.uk.capgemini.com/careers/jobs/management-consulting-graduate-programme-2015,MultiPoint,-0.1276474,51.5073219,Consulting,capgemini,Permanent,2015-07-22T03:07:33.884000,London,GAP00010_uk,Capgemini,2015-06-08T20:33:24+00:00,Entry level / Graduate,Technology,Technology Services,IT Services,Capgemini Consulting,,,,,,,,,,,,,
de,1,Deutsche Telekom AG,"### StellenbeschreibungStellenbeschreibungxplosion interactive ist ein junges Unternehmen der Digital Advertising Szenein Hamburg und Spezialist für dynamisches Retargeting und Data-Driven-Products. Unser Team aus Digital Natives, Marketingexperten sowie Daten- undTechnologie-Spezialisten hilft Online- und E-Commerce-Kunden, Digitalkampagnenmarkengerecht und performance-orientiert zu planen und umzusetzen. xplosioninteractive gehört zu InteractiveMedia CCSP GmbH und gliedert sich so in dieKonzernstruktur der Deutsche Telekom AG ein.In unserem Hamburger Büro bieten wir Dir neben einem spannenden Aufgabengebietmit Eigenverantwortung und Entwicklungsmöglichkeiten viel Raum für eigeneIdeen. Auf Dich wartet ein moderner und technisch hervorragend ausgestatteterArbeitsplatz in toller Arbeitsatmosphäre mit einem jungen und erfolgreichenTeam.Weitere Informationen findest Du unter www.xplosion.de.Zur Unterstützung unseres Data Science suchen wir **ab sofort **einen**(Senior) Software Developer für Data Science (m/w)**zur Festanstellung**Deine Aufgaben**  * Du entwickelst und pflegst unsere JVM-basierten Frameworks für das maschinelle Lernen, die Optimierung und automatisierte Entscheidungsfindung.  * Du entwickelst Software in enger Zusammenarbeit mit Data Scientists: Du bist deren „Enabler“ und überführst z. B. moderne Lernalgorithmen in die Produktion.  * Zum Aufgabenspektrum zählt ebenso die Auswahl von Technologien, Bibliotheken und Frameworks als auch der Entwurf von Architekturen für Data Processing Systeme.  * Du implementierst, testet und evaluierst Lern- und Optimierungsalgorithmen im Kontext von aktuellen Big Data Technologien (Hadoop, Spark, gängige Streaming-Frameworks)**Dein Profil**  * Abgeschlossenes Universitätsstudium der Informatik (Master/Diplom)  * min. 2-3 Jahre Berufserfahrung als Softwareentwickler  * Gute bis sehr gute Mathematikkenntnisse (lineare Algebra, Statistik, Optimierung, Numerik)  * Nachgewiesene Kenntnis von Machine Learning Methoden und Algorithmen  * Erfahrung im Umgang mit einschlägigen Machine Learning Bibliotheken bzw. Frameworks (z. B. Weka, Mahout, Torch, etc.)   * Fundierte Kenntnisse in der Verwaltung großer Datenmengen mit relationalen und NoSQL-Datenbanken**Was wir bieten**  * Cutting-Edge Technologien und das Arbeiten auf Daten, die in Bezug auf Qualität und Volumen deutschlandweit einzigartig sind.  * Die Möglichkeit, in einem hochmotivierten und –qualifiziertem Team von Big Data- und Machine Learning Enthusiasten Forschung und Entwicklung zu betreiben.  * Überdurchschnittliche Vergütung: Spitzenleistung wissen wir zu schätzen und sie wird belohnt.  * Flache Hierarchien, eine Kultur der Wertschätzung, hervorragendes Arbeitsklima und exzellente Karrieremöglichkeiten.  * Ausführliche Einarbeitung in das Online-Business durch kompetente Kollegen.  * Ein Büro in zentrumsnaher Lage über den Dächern von Hamburg mit Blick auf die Außenalster, hervorragender Anbindung an die öffentlichen Verkehrsmittel und Zuschuss zur ProfiCard der HVV.** ****Interessiert?**Deine Bewerbungsunterlagen sendest Du über unsere Jobbörse. Bei Fragen stehtDir Adeline Paasch unter 040/2850 7000 gerne zur Verfügung.",(Senior) Software Developer für Data Science (m/w) - xplosion interactive GmbH,"https://jobwelt.telekom.com/jpapps/n/int_open/jv/,00043481",MultiPoint,10.01534,53.57532,DAX,telekomIntern,Vollzeitbeschäftigung,2015-03-15T19:06:43,"xplosion interactive GmbH, Hamburg",00043481,Telekom,2015-01-19T19:09:29+00:00,,Communications,Telecom,Telecom Carriers,Strategie,Consulting,,,,,,,,,Human Resources,Prozesse,Revision,
en,1,Merck KGaA,"_Description:_EMD Millipore and EMD Serono, are affiliates** of Merck KGaA, a **leadingcompany for innovative and top-quality high-tech products in thepharmaceutical and chemical sectors. Around 39,000 employees work in 66countries to improve the quality of life for patients, to further the successof our customers and to help meet global challenges. We generated totalrevenues of € 11.1 billion in 2013 with our three businesses: Healthcare, LifeScience and Performance Materials**. Currently we have an opening for Big DataSoftware Engineer.****Responsibilities:**Responsible for architecting and developing advanced analytical solutionswithin a Hadoop based architecture to drive a pervasive analytical culture andenable breakthrough business objectives.This technical role requires deep knowledge and experience with Hadoop andother big data platforms. The candidate will work closely with architects,business analyst to design and implement various parts of the new dataanalytics platforms. Together with key business subject matter experts they’llwork on complex analytics models.    * **Required Experience and Skills:**    * analytical and problem-solving skills, and ability to work with incomplete or imperfect data    * Ability to identify and visualize relationships within large, not obviously related data sets.    * Knowledge of the data management eco-system including: Concepts of data warehousing, ETL, data integration, etc.    * Minimum 3 years hands-on development in Java including familiarity with scripting tools such as bash shell scripts, Python and/or Perl    * 2+ years working with and developing within a Hadoop platform       * Implementing MapReduce Jobs      * Designing data queries against data in the HDFS environment using tools such as Apache Hive    * Ability to understand big data use-cases, and recommend standard design patterns commonly used in Hadoop-based deployments.    * Excellent Communication, collaboration and team skills    *   * **Desired Experience and Skills:**    * Knowledge of other big data platforms    * Experience with various visualization tools (Tableau, R, etc.)    * Experience with various database systems (i.e. Oracle)    * Experience with development tools and tools platforms (i.e. Flume, Sqoop, PIG, HIVE, etc.)    * Experience writing to network-based APIs, preferably REST/JSON or XML/SOAP    * Experience developing application using REST API architecture a plus    * Experience developing using an AGILE Methodology (i.e. SCRUM, LEAN, etc.)**Education Minimum Requirement:**  • MSc Degree or BSc Degree or equivalent with relevant experience in ComputerScience, Computer Science Engineering, Math, Data Science or equivalentexperience.",Big Data Software Engineer,https://career012.successfactors.eu/career?career%5fns=job%5flisting&company=merckgroup&navBarLevel=JOB%5fSEARCH&rcm%5fsite%5flocale=de%5fDE&career_job_req_id=75662,MultiPoint,-71.268947,42.5584264,DAX,merck,Vollzeit,2015-05-18T01:38:07.963000,"Billerica, USA",75662,Merck Group,2015-04-02T10:42:41+00:00,,Health Care,Biotech & Pharma,Biotech,Informationstechnologie,,,,,,,,,,,,,
en,1,JobServe,"My client is an ambitious consultancy specialised in the area of big datascience and engineering.  Their services situate mainly in the transition from previous generationinformation architectures to the new generation of technologies and analytics.    The team has a scientific background, industry experts and thought-leaders whohave worked extensively with Hadoop, NoSQL databases like Cassandra, CouchDB,search technologies like Elasticsearch, Solr and related technologies like R,Python etc    Role  Deep learning from data in order to guide the business forward.  Understand business drivers functional and non functional  Architecting solutions to collect, stream, store and analyse a variety ofstructured and unstructured data.  Designing scalable systems.  Design trend detection/pattern recognition algorithms for predictiveanalytics.    Skills and Experience  Strong academic background.  Experience working with large data sets using technologies such as MapReduce,Hadoop, HBase, Hive and NoSQL.  Experience with visualization technologies.  Experience with predictive analytics using R or SaS in PoC/prototyping is aplus.  Experience with Real Time analysis of sensor/data from Internet of Things is aplus.  Preferred candidates have 5 - 7 years of software engineering experience withrelevant technologies.  Preferred candidates would have experience in finance/banking/insurance    Tools  Python/Bash/Ruby  Java/Scala/C++  Hadoop/Cassandra/MongoDB  SQL/REST API/JSON  Linux and Bash Scripting  Lucene/ElasticSearch/SOLR  Agile  HTML5/JavaScript/AngularJS    To be successful, you will need to have a background in a quantitative ortechnical field, have experience working with large data sets, and will havesome experience in data-driven decision making. In addition, you must be aself-starter, and have demonstrated success in using analytics to drive theunderstanding, growth, and success of a product.    We look forward to the influx Data Scientists/Data Engineers/Big Data guruswith an infatuation for making a name within the Big Data domain.",BigData Scientist/Engineer - (multiple roles),http://www.jobserve.com/nl/en/mob/job/3E793FC8F6FE1EAB,MultiPoint,4.8979956033677,52.374436,Job Board,jobserveNl,Permanent,2015-07-01T07:03:41.962000,"Amsterdam, Netherlands",3E793FC8F6FE1EAB,Astbury Marsden,2015-06-28T01:10:30+00:00,EUR65k - EUR85k per annum + car/Pension/negociable,,,,,,,,,,,,,,,,,
en,1,Google Inc,"At Google, data drives all of our decision-making, and our HR organization isno exception. The People Analytics team acts as an internal innovation lab,using analytical approaches to make sure Google continues to be a great placeto work. The team provides critical support to the business around issues oforganizational health and is responsible for not just taking the pulse of ourGooglers, but harnessing Googler feedback to drive change for the better. Asan analyst you'll be detail-oriented and conscientious, analytical andcurious. You're a strong problem-solver, who uses both quantitative andqualitative methods to get things done. And on top of it all, you're someonewho wonders ""What if?"" and then seeks out the solution.As a member of the newly created People Data Science & Technology team,you’ll help a team comprised primarily of social scientists learn to takeadvantage of their increasing access to big behavioral datasets. You’ll bridgethe gaps between our team of researchers and Google’s software engineers andstatisticians. You’ll be extremely proficient technically with a stronginterest in applying your skills to improving understanding of human behavior.You’ll be excited to learn from and contribute to the great Google statisticscommunity and to share and apply your learning on project with PeopleAnalytics teammates.Responsibilities  * Access and leverage behavioral, network and unstructured data sets by writing and testing data mining, text and sentiment analysis, clustering, and other types of machine learning algorithms.  * Collaborate with a team of analysts and social scientists to conduct in-depth analysis, design and analyze experiments.  * Keep People Analytics connected to Google’s statistics community, act as our statistical subject matter expert and push the team forward on advanced analytical methods.  * Influence senior social scientists, human resources and business leaders through strong communication skills and deep subject matter expertise.Minimum qualifications  * MA degree in Computational Science, Computational Data Science, Computational Social Science, Applied Statistics, Management Science and Engineering, Operations Research, Biostatistics or Data Sciences or equivalent practical experience.  * 3 years of experience with machine learning, data mining or statistical work.  * Experience with statistical analysis and classification methods like K-Means, KNN, SVMs, Deep Learning/Neural Networks, Decision Trees, Random Forests, Logistic Regression, Multinomial Logit, etc.Preferred qualifications  * PhD degree in a quantitative field (Math, Statistics, Computer Science, Engineering, Data Science, Operations Research, Biostatistics).  * 5 years of applied experience with machine learning, data mining or statistical work.  * Experience with unstructured data (e.g., text). Ability to use data to tell a story based on the insights from complex analysis.  * Experience with web-based data visualization skills (e.g., D3.js). Front-end web development experience.  * Experience drawing insights from large longitudinal behavioral datasets such as datasets that constantly track movement, from a perspective of enabling individuals vs. enabling companies.  * Strong learning and teaching orientation: constantly seeking to improve your own skills and willing to invest in building the skills of those around you. Interest in social sciences in application of social sciences to People Analytics.","Data Science Manager, People Analytics Team",https://www.google.com/about/careers/search#!t=jo&jid=111145001&,MultiPoint,-121.705327,37.189396,ForbesMVB,google,Full-time,2015-08-05T03:20:27.754000,"Mountain View, CA, USA",111145001,Google,2015-06-02T08:57:37+00:00,,Communications,Media,Internet Media,People Operations,,,,,,,,,,,,,
